a) TCL COMMANDS

1.Commit
 
Database changed
mysql> SELECT * FROM NIHAL;
+------+-------+
| ID   | NAME  |
+------+-------+
|  108 | LINTO |
|  109 | nihal |
+------+-------+
2 rows in set (0.01 sec)
mysql> set autocommit=off;
Query OK, 0 rows affected (0.00 sec)

mysql> delete from NIHAL WHERE ID=108;
Query OK, 1 row affected (0.00 sec)

mysql> SELECT * FROM NIHAL;
+------+-------+
| ID   | NAME  |
+------+-------+
|  108 | LINTO |
|  109 | nihal |
+------+-------+
2 rows in set (0.00 sec)



mysql> set autocommit=off;
Query OK, 0 rows affected (0.00 sec)


mysql> delete from NIHAL WHERE ID=108;
Query OK, 1 row affected (0.01 sec)

mysql> commit;
Query OK, 0 rows affected (0.00 sec)

mysql> SELECT * FROM NIHAL;
+------+-------+
| ID   | NAME  |
+------+-------+
|  109 | nihal |
+------+-------+
1 row in set (0.00 sec)




 2.    Rollback
 
Database changed
mysql> set autocommit=off;
Query OK, 0 rows affected (0.00 sec)

mysql> SELECT * FROM NIHAL;
+------+-------+
| ID   | NAME  |
+------+-------+
|  108 | LINTO |
|  109 | nihal |
|  102 | jesse |
+------+-------+
3 rows in set (0.00 sec)

mysql> DELETE FROM NIHAL where id=102;
Query OK, 1 row affected (0.00 sec)

mysql> SELECT * FROM NIHAL;
+------+-------+
| ID   | NAME  |
+------+-------+
|  108 | LINTO |
|  109 | nihal |
+------+-------+
2 rows in set (0.00 sec)

mysql> rollback;
Query OK, 0 rows affected (0.01 sec)

mysql> SELECT * FROM NIHAL;
+------+-------+
| ID   | NAME  |
+------+-------+
|  108 | LINTO |
|  109 | nihal |
|  102 | jesse |
+------+-------+
3 rows in set (0.00 sec)

mysql> DELETE FROM NIHAL where id=102;
Query OK, 1 row affected (0.00 sec)

mysql> commit;
Query OK, 0 rows affected (0.00 sec)

mysql> SELECT * FROM NIHAL;
+------+-------+
| ID   | NAME  |
+------+-------+
|  108 | LINTO |
|  109 | nihal |
+------+-------+
2 rows in set (0.00 sec)

mysql> rollback;
Query OK, 0 rows affected (0.00 sec)

mysql> SELECT * FROM NIHAL;
+------+-------+
| ID   | NAME  |
+------+-------+
|  108 | LINTO |
|  109 | nihal |
+------+-------+
2 rows in set (0.00 sec) 




3.Savepoint
 
 mysql> set autocommit=off;
Query OK, 0 rows affected (0.00 sec)

mysql> insert into NIHAL values(138,'rosh');
Query OK, 1 row affected (0.00 sec)
mysql> set savepoint s1;

 mysql> insert into NIHAL values(128,'rosh');
Query OK, 1 row affected (0.00 sec)

mysql> savepoint s2;
Query OK, 0 rows affected (0.00 sec)

mysql> insert into NIHAL values(158,'rosh');
Query OK, 1 row affected (0.00 sec)

mysql> savepoint s3;
Query OK, 0 rows affected (0.00 sec)

mysql> SELECT * FROM NIHAL;
+------+-------+
| ID   | NAME  |
+------+-------+
|  108 | LINTO |
|  109 | nihal |
|  138 | rosh  |
|  128 | rosh  |
|  158 | rosh  |
+------+-------+
5 rows in set (0.00 sec)

mysql> rollback to s2;
Query OK, 0 rows affected (0.00 sec)

mysql> SELECT * FROM NIHAL;
+------+-------+
| ID   | NAME  |
+------+-------+
|  108 | LINTO |
|  109 | nihal |
|  138 | rosh  |
|  128 | rosh  |
+------+-------+
4 rows in set (0.00 sec)

b) DCL COMMAND
Create two users user1, user2
 
mysql> CREATE USER user1@'localhost' IDENTIFIED BY 'User1@123';
mysql> CREATE USER user2@'localhost' IDENTIFIED BY 'User2@123';

1.GRANT

Give insert and select privilege to user 1 on customer table in the invoice database.

mysql> grant select,insert on INVOICE.Customer to user1@'localhost';
Query OK, 0 rows affected (0.00 sec)
mysql> show grants for user1@'localhost';
+---------------------------------------------------------------------+
| Grants for user1@localhost                                          |
+---------------------------------------------------------------------+
| GRANT USAGE ON *.* TO `user1`@`localhost`                           |
| GRANT SELECT, INSERT ON `INVOICE`.`Customer` TO `user1`@`localhost` |
+---------------------------------------------------------------------+
2 rows in set (0.00 sec)

Give update and delete privilege to user 2 on all tables in the invoice database.

mysql> grant update,delete on INVOICE.* to user2@'localhost';
Query OK, 0 rows affected (0.00 sec)

mysql> show grants for user2@'localhost';
+---------------------------------------------------------------------+
| Grants for user2@localhost                                          |
+---------------------------------------------------------------------+
| GRANT USAGE ON *.* TO `user2`@`localhost`                           |
| GRANT UPDATE, DELETE ON `INVOICE`.* TO `user2`@`localhost`          |
| GRANT UPDATE, DELETE ON `INVOICE`.`Customer` TO `user2`@`localhost` |
+---------------------------------------------------------------------+
3 rows in set (0.00 sec)



2.REVOKE

Remove delete privilege of user 2

mysql> revoke delete on INVOICE.* from user2@'localhost';
Query OK, 0 rows affected (0.01 sec)


mysql> show grants for user2@'localhost';
+-------------------------------------------------------------+
| Grants for user2@localhost                                  |
+-------------------------------------------------------------+
| GRANT USAGE ON *.* TO `user2`@`localhost`                   |
| GRANT UPDATE ON `INVOICE`.* TO `user2`@`localhost`          |
| GRANT UPDATE ON `INVOICE`.`Customer` TO `user2`@`localhost` |
+-------------------------------------------------------------+
3 rows in set (0.00 sec)

